{
  "format": "mooyu.courseware-module",
  "schemaVersion": 1,
  "id": "challenge.safe-no2-batch",
  "version": "1.0.0",
  "kind": "challenge",
  "apiVersion": 1,
  "entry": "./index.mjs",
  "integrity": "sha256:cafa93de4cb205dfe90fe344df02f3adfc316836c0c20c78ca565d9708810ba9",
  "hotSwap": "paused",
  "stateSchemaVersion": 1,
  "capabilities": [
    "challenge.evaluate"
  ],
  "commands": [
    "challenge.attempt",
    "challenge.reset"
  ],
  "dependencies": [
    {
      "id": "chemistry.equilibrium",
      "apiVersion": 1,
      "capabilities": [
        "domain.equilibrium"
      ]
    }
  ]
}
