{
  "format": "mooyu.courseware-module",
  "schemaVersion": 1,
  "id": "math.quadratic",
  "version": "1.0.0",
  "kind": "domain",
  "apiVersion": 1,
  "entry": "./index.mjs",
  "integrity": "sha256:86495ec52ca7444dc15c91b6c68e738e571d603cf4ff42993ef367bf55aa526a",
  "hotSwap": "paused",
  "stateSchemaVersion": 1,
  "capabilities": [
    "domain.function"
  ],
  "commands": [
    "coefficient.set",
    "sample.set",
    "reference.toggle",
    "model.reset"
  ],
  "dependencies": []
}
