{
  "format": "mooyu.courseware-module",
  "schemaVersion": 1,
  "id": "component.workbench",
  "version": "1.0.0",
  "kind": "component",
  "apiVersion": 1,
  "entry": "./index.mjs",
  "integrity": "sha256:b444a28e3b6f4b6d0527d9ff41a058ee53d67295b0457a75c77ef8d292a4f263",
  "hotSwap": "live",
  "stateSchemaVersion": 1,
  "capabilities": [
    "component.workbench"
  ],
  "commands": [
    "experience.set",
    "panel.set",
    "locale.set",
    "motion.set"
  ],
  "dependencies": []
}
