{
  "format": "mooyu.courseware-module",
  "schemaVersion": 1,
  "id": "component.courseware-ui",
  "version": "1.4.2",
  "kind": "component",
  "apiVersion": 1,
  "entry": "./index.mjs",
  "integrity": "sha256:90c4c7dcb54775ca591af58db27e4891b1836c94bf9fdae122dbd6c7e4e46f56",
  "hotSwap": "live",
  "stateSchemaVersion": 1,
  "capabilities": [
    "component.courseware-ui",
    "component.courseware-ui.shell"
  ],
  "commands": [],
  "dependencies": []
}
